{
  "@context": [
    "https://www.w3.org/2018/credentials/v1",
    "https://nebulis.github.io/tmp-jsonld/DrivingLicenceCredential.jsonld",
    "https://nebulis.github.io/tmp-jsonld/OpenAttestation.v3.jsonld",
    "https://nebulis.github.io/tmp-jsonld/CustomContext.jsonld"
  ],
  "reference": "SERIAL_NUMBER_123",
  "name": "Republic of Singapore Driving Licence",
  "issuanceDate": "2010-01-01T19:23:24Z",
  "validFrom": "2010-01-01T19:23:24Z",
  "issuer": {
    "id": "https://example.com",
    "name": "DEMO STORE",
    "identityProof": {
      "type": "DNS-TXT",
      "location": "tradetrust.io"
    }
  },
  "type": ["VerifiableCredential", "DrivingLicenceCredential"],
  "credentialSubject": {
    "id": "did:example:SERIAL_NUMBER_123",
    "class": [
      {
        "type": "3",
        "effectiveDate": "2010-01-01T19:23:24Z"
      },
      {
        "type": "3A",
        "effectiveDate": "2010-01-01T19:23:24Z"
      }
    ]
  },
  "template": {
    "name": "CUSTOM_TEMPLATE",
    "type": "EMBEDDED_RENDERER",
    "url": "https://localhost:3000/renderer"
  },
  "oaProof": {
    "type": "OpenAttestationProofMethod",
    "method": "DOCUMENT_STORE",
    "value": "0x9178F546D3FF57D7A6352bD61B80cCCD46199C2d"
  },
  "evidence": [
    {
      "type": "DocumentVerification2018",
      "fileName": "sample.pdf",
      "mimeType": "application/pdf",
      "data": "BASE64_ENCODED_FILE"
    }
  ]
}
